{
  "protocol_version": "XLMP/1",
  "status": "prepared_unsigned",
  "preflight_id": "xlr:blake3:f16492c1408cae9451f760dc9aa756f360303de5a383d91233428a7263f6ddcc",
  "policy_id": "xlpolicy:blake3:14fa69b11fd01faed695aee2724a6e0e4f34edc7eb702decb37387d892bd5aab",
  "trust_root": "xlpolicy:blake3:2ea9cb29893b3725d0a4a116a43d5f3a868374ee70bad3416616bd9915d475a9",
  "intent_id": "xlr:blake3:505c631587a1ffffdf6692ab107bbd89e7f7eadefbe47f7b40b8af8a80608a51",
  "researcher_id": "xlresearcher:blake3:8e613ce9fb5b32c58ff2b3622aba3485181db21b0a1f4fed89ffc368e68f525b",
  "chain_id": 84532,
  "wallet_address": "0x0000000000000000000000000000000000000003",
  "escrow_address": "0x0000000000000000000000000000000000000064",
  "usdc_asset": "eip155:84532/erc20:0x036cbd53842c5426634e7929541ec2318f3dcf7e",
  "entry_point_address": "0x0000000071727de22e5e9d8baf0edac6f37da032",
  "paymaster_address": "0x31be08d380a21fc740883c0bc434fcfc88740b58",
  "method": "fund(bytes32,uint8,uint256,bytes32)",
  "arguments": [
    "0x1111111111111111111111111111111111111111111111111111111111111111",
    "0",
    "10000000",
    "0x2222222222222222222222222222222222222222222222222222222222222222"
  ],
  "maximum_escrow_allowance_units": 10000000,
  "maximum_paymaster_allowance_units": 250000,
  "required_wallet_balance_units": 10250000,
  "checked_at": 1788998460,
  "expires_at": 1788998700,
  "owner_signature_required": true,
  "funds_reserved": false
}
